{
  "mode": "quick",
  "status": "ready",
  "task": "Cambiar color del bot\u00f3n a rojo",
  "target_agent": "frontend",
  "scope_constraint": "Implementa SOLO el cambio descrito en 'task'. No refactorices, no agregues abstracciones, no toques archivos fuera del scope. Si el cambio requiere mas de 3 archivos o logica de negocio nueva, escala con status='escalated'.",
  "complexity_score": 0
}
